producto,referencia,precio
Intibon Secretos Naturales Salvia-Calendula,7702277751502,11850.0
Cicaderm Jabón Antibacterial,7707173604259,43400.0
Dove Baby Jabón Líquido H Enr 400ml,7891150036369,33550.0
Dove Baby Jabón Líquido H Sens 400ml,7891150036383,33600.0
Jabón Dove Revigorizante Pquete 3 Un x 90 Gramos,7891150074422,17700.0
Jabón Líquido Baby Dove Humectación Enriquecida,7891150025981,22050.0
Babaria Jabón Íntimo Aloe Vera,8410412028516,16700.0
Babaria Jabón Íntimo Rosa Mosqueta,8410412028523,16700.0
Effaclar Jabón Barra Limpieza Profunda,7899706149211,50300.0
Jabón Dove Blanco Original,7898422746759,6300.0
Jabón Hidratante Dove Baby,7891150026025,6850.0
Cetaphill Loción Limpiadora,8430351066011,56880.0
Salises Crema Espumosa Sin Jabón Sesderma,8429979475121,131100.0
Hidraderm Leche Limpiadora Sesderma,8470002507616,105400.0
Dove Jabón Cuidado Protege X90g,7891150075382,6350.0
Hidraven Crema Espuma Sin Jabón Sesderma,8470003643153,124400.0
Jabón De Tocador Dove Baby Humectación Sensible,7702191662977,15000.0
Jabón De Tocador Dove Baby Humectación Enriquecida,7702191662960,15000.0
Jabón Facial Deeep Clean Intensive Neutrogena,7891010099725,18200.0
Loción Antimosquito Jhonson's Baby,7891010919221,33100.0
Gelclin Locion,7707327210039,75900.0
